{
  "budget_ceiling": {
    "artifact_bytes": 16777216,
    "concurrent_reads": 4,
    "concurrent_writes_per_resource": "one",
    "cpu_ms": 1800000,
    "currency": "EUR",
    "currency_micro_units": 0,
    "elapsed_ms": 1800000,
    "model_requests": 12,
    "model_tokens_total": 20000,
    "scratch_bytes": 1073741824,
    "tool_attempts": 64
  },
  "effect_classes": [
    "read",
    "local_reversible_write"
  ],
  "expires_at_unix_ms": 2000000000000,
  "grant_id": "grant-01",
  "parent_grant_id": null,
  "policy_digest": "aaaaaaaaaaaaaaaaaaaaaaaaaaaaaaaaaaaaaaaaaaaaaaaaaaaaaaaaaaaaaaaa",
  "principal_id": "principal-01",
  "resource_ids": [
    "worktree-01"
  ],
  "schema": "gabriel.grant/1",
  "task_id": "task-01",
  "tool_ids": [
    "tool.test"
  ],
  "workspace_id": "ws-01"
}
